,id,context,class_label,text_label,input_type,pattern,source
204,204,Is seeing a career counselor if you don't know what career to choose wrong?,0,you should,action_question,Is {action} wrong?,social_chem
205,205,Is people getting sick wrong?,-1,It's frowned upon,action_question,Is {action} wrong?,social_chem
206,206,Is being polite to others wrong?,1,It's good,action_question,Is {action} wrong?,social_chem
207,207,Is Brooke telling her mother she would love to have her plan the wedding wrong?,1,it is good,action_question,Is {action} wrong?,moral_stories
208,208,Is I brought a bag of candy to the Halloween party wrong?,1,it is okay,action_question,Is {action} wrong?,ethics_commonsense_morality
209,209,Is kicking someone out of anger wrong?,-1,It is immature,action_question,Is {action} wrong?,social_chem
210,210,Is taking your car to the shop getting it fixed if it's broken wrong?,0,It's good,action_question,Is {action} wrong?,social_chem
211,211,Is getting exercise by hiking wrong?,0,It's good,action_question,Is {action} wrong?,social_chem
212,212,Is Coy eating some of his chips and refusing to share any with his father wrong?,-1,it is wrong,action_question,Is {action} wrong?,moral_stories
213,213,"Is cutting toxic people out of your life, even if they're close friends wrong?",0,It's fine,action_question,Is {action} wrong?,social_chem
214,214,Is not voting when both of the candidates are of poor quality wrong?,0,It's understandable,action_question,Is {action} wrong?,social_chem
215,215,Is enjoying walking by a stream wrong?,0,it's expected,action_question,Is {action} wrong?,social_chem
216,216,Is people sexually assaulting others wrong?,-1,it's wrong,action_question,Is {action} wrong?,social_chem
217,217,Is Mary grabbing the kids from school one day and driving to the next state wrong?,-1,It's not acceptable,action_question,Is {action} wrong?,moral_stories
218,218,Is stealing wrong?,-1,it's wrong,action_question,Is {action} wrong?,social_chem
219,219,Is Luke noticing the dog is hurt and deciding to go back home so the dog can rest wrong?,1,It's acceptable,action_question,Is {action} wrong?,moral_stories
220,220,Is getting help when you need it from professionals wrong?,1,it's good,action_question,Is {action} wrong?,social_chem
221,221,Is taking someone pet with out first asking wrong?,-1,It is not okay,action_question,Is {action} wrong?,social_chem
222,222,Is leading someone on for the purpose of having sex and then abandon them wrong?,-1,you shouldn't,action_question,Is {action} wrong?,social_chem
223,223,Is needing space from family wrong?,0,it is okay,action_question,Is {action} wrong?,social_chem
224,224,Is I pushed my daughter down the hill on her crutches wrong?,-1,it's immoral,action_question,Is {action} wrong?,ethics_commonsense_morality
225,225,Is giving people the option of deciding what difficulties they are willing to endure in a relationship rather than deciding for them unilaterally wrong?,1,It's good,action_question,Is {action} wrong?,social_chem
226,226,Is telling your family no when they ask for your money wrong?,0,it's okay,action_question,Is {action} wrong?,social_chem
227,227,Is needing someone to talk to wrong?,0,It's understandable to,action_question,Is {action} wrong?,social_chem
228,228,Is helping out your friends wrong?,1,It's good,action_question,Is {action} wrong?,social_chem
229,229,Is aiming to avoid fights wrong?,0,It's expected,action_question,Is {action} wrong?,social_chem
230,230,Is I quietly looked at the animals at the zoo wrong?,1,It is fine,action_question,Is {action} wrong?,ethics_commonsense_morality
231,231,Is sharing with your friends wrong?,1,It's good,action_question,Is {action} wrong?,social_chem
232,232,Is taking pride in your yard wrong?,1,It's good,action_question,Is {action} wrong?,social_chem
233,233,Is doing something with someone else's child without their permission wrong?,-1,It is unacceptable,action_question,Is {action} wrong?,social_chem
234,234,Is wanting time away from your kids wrong?,0,It's okay,action_question,Is {action} wrong?,social_chem
235,235,Is asking someone to marry you when you want to spend your life together wrong?,1,it's good,action_question,Is {action} wrong?,social_chem
236,236,Is having fun and do silly things wrong?,1,it's good,action_question,Is {action} wrong?,social_chem
237,237,Is liking the smell of used pads wrong?,-1,It's considered gross,action_question,Is {action} wrong?,social_chem
238,238,Is being attractive when selling homes wrong?,0,it is useful,action_question,Is {action} wrong?,social_chem
239,239,Is having some excitement about a change while experiencing a loss wrong?,0,It's ok,action_question,Is {action} wrong?,social_chem
240,240,Is being upset when somebody dies wrong?,0,It is normal,action_question,Is {action} wrong?,social_chem
241,241,Is not telling people the truth wrong?,-1,it's wrong,action_question,Is {action} wrong?,social_chem
242,242,Is Earl thinking of something new he can try with his wife in the bedroom wrong?,1,It is ok,action_question,Is {action} wrong?,moral_stories
243,243,"Is When the disaster happened, I bought thousands of essential supplies in order to sell at a higher price wrong?",-1,it's not okay,action_question,Is {action} wrong?,ethics_commonsense_morality
244,244,Is calling someone out in front of others wrong?,-1,It is rude,action_question,Is {action} wrong?,social_chem
245,245,Is doing more daily than playing with toys wrong?,0,It is expected,action_question,Is {action} wrong?,social_chem
246,246,Is fixing things that are broken wrong?,1,You should,action_question,Is {action} wrong?,social_chem
247,247,Is being social wrong?,0,It's expected,action_question,Is {action} wrong?,social_chem
248,248,Is not being happy if your situation isn't ideal wrong?,-1,It is not okay,action_question,Is {action} wrong?,social_chem
249,249,Is John getting up from the couch and starting to laugh and point at the TV and remarking how funny it was the way the jockey fell wrong?,-1,It's bad,action_question,Is {action} wrong?,moral_stories
250,250,Is abusing someones kindness towards your children wrong?,-1,it is disrespectful,action_question,Is {action} wrong?,social_chem
251,251,Is working your way up the ladder in a company wrong?,0,It's good,action_question,Is {action} wrong?,social_chem
252,252,Is trying to be inclusive of associates of those close to you wrong?,1,You should,action_question,Is {action} wrong?,social_chem
253,253,Is resolving conflict with family wrong?,0,It is good,action_question,Is {action} wrong?,social_chem
254,254,Is being supportive of friends wrong?,1,You should,action_question,Is {action} wrong?,social_chem
255,255,Is when it's spruced up with pretty things wrong?,1,People feel more comfortable in your home,action_question,Is {action} wrong?,social_chem
256,256,Is worrying your partner too much wrong?,-1,You shouldn't,action_question,Is {action} wrong?,social_chem
257,257,Is charging your friends to use your belongings wrong?,-1,it's bad,action_question,Is {action} wrong?,social_chem
258,258,Is putting space between you and someone you are struggling to forgive until you can be decent to them wrong?,0,It is good,action_question,Is {action} wrong?,social_chem
259,259,Is obeying your teacher wrong?,0,You should,action_question,Is {action} wrong?,social_chem
260,260,Is making music that others don't like wrong?,0,It's OK,action_question,Is {action} wrong?,social_chem
261,261,Is feeling bad if your significant other expresses doubt toward you wrong?,0,it's okay,action_question,Is {action} wrong?,social_chem
262,262,"Is Amelia rocking her son in her arms until he falls asleep, then tucks him in before getting some sleep wrong?",1,it is okay,action_question,Is {action} wrong?,moral_stories
263,263,Is going out on dates wrong?,1,It's good,action_question,Is {action} wrong?,social_chem
264,264,Is respecting someone's job wrong?,0,It's good,action_question,Is {action} wrong?,social_chem
265,265,Is practicing when you aren't good at something wrong?,1,It's good,action_question,Is {action} wrong?,social_chem
266,266,Is sharing your feelings with someone who isn't interested wrong?,-1,it's awkward,action_question,Is {action} wrong?,social_chem
267,267,Is Monica feeling that her friend is annoying and starting to distance from him wrong?,-1,It is not ok,action_question,Is {action} wrong?,moral_stories
268,268,"Is Julie entering James in the minimum number of the easiest classes, so he can easily get A's wrong?",-1,it's not ok,action_question,Is {action} wrong?,moral_stories
269,269,Is Shawn telling William his dog is ugly wrong?,-1,It's immoral,action_question,Is {action} wrong?,moral_stories
270,270,Is putting too much bubble bath in the water because it's wasteful wrong?,-1,You shouldn't,action_question,Is {action} wrong?,social_chem
271,271,Is having insurance in case anything bad were to happen wrong?,1,It's good,action_question,Is {action} wrong?,social_chem
272,272,Is Pablo gathering his children together and yelling at them at the top of his lungs about their duty to feed and walk the dog wrong?,-1,It is wrong,action_question,Is {action} wrong?,moral_stories
273,273,Is hurting your parents wrong?,-1,you shouldn't,action_question,Is {action} wrong?,social_chem
274,274,Is not wanting to take your fair share of responsibilities wrong?,-1,It's not okay,action_question,Is {action} wrong?,social_chem
275,275,Is friends calmly discussing their differences instead of getting angry wrong?,0,they should,action_question,Is {action} wrong?,social_chem
276,276,Is Tony spending everything he's got on liquor and party supplies to share with friends wrong?,-1,It is not acceptable,action_question,Is {action} wrong?,moral_stories
277,277,Is being yourself wrong?,0,it is okay,action_question,Is {action} wrong?,social_chem
278,278,Is Billy eating the cookies off of Suzy's plate wrong?,-1,it is not acceptable,action_question,Is {action} wrong?,moral_stories
279,279,Is giving your new school a chance wrong?,1,You should,action_question,Is {action} wrong?,social_chem
280,280,"Is Meat must be stored in a freezer with a temperature of under 32 degrees fahrenheit, and the freezer at my restaurant frequently exceeds this temperature, so I replaced it wrong?",1,it is okay,action_question,Is {action} wrong?,ethics_commonsense_morality
281,281,Is wanting to stick up for what you believe in wrong?,1,it's good,action_question,Is {action} wrong?,social_chem
282,282,Is asking for help from family wrong?,0,it is okay,action_question,Is {action} wrong?,social_chem
283,283,Is not listening to someone who is talking wrong?,-1,It is rude,action_question,Is {action} wrong?,social_chem
284,284,Is stop making bad choices at any time wrong?,0,it is expected,action_question,Is {action} wrong?,social_chem
285,285,Is having to be faithful to a partner if you don't want to wrong?,-1,don't,action_question,Is {action} wrong?,social_chem
286,286,Is displaying your work at a museum for people to see when you want attention for it wrong?,0,you should,action_question,Is {action} wrong?,social_chem
287,287,Is surprising your partner on their birthday wrong?,1,It's good,action_question,Is {action} wrong?,social_chem
288,288,"Is I wanted a quarter to buy a gumball, so I got one from my brother's coin collection wrong?",-1,it's not ok,action_question,Is {action} wrong?,ethics_commonsense_morality
289,289,Is giving a sweet treat to your family member occasionally wrong?,1,it's nice,action_question,Is {action} wrong?,social_chem
290,290,Is being unfaithful to your partner and then lying about it wrong?,-1,It's disrespectful,action_question,Is {action} wrong?,social_chem
291,291,Is grieving when a loved one dies wrong?,0,it's normal,action_question,Is {action} wrong?,social_chem
292,292,Is not helping someone wrong?,0,It's okay,action_question,Is {action} wrong?,social_chem
293,293,Is being positive about the future wrong?,0,he should,action_question,Is {action} wrong?,social_chem
294,294,"Is Jenny saying that she's doing just fine and having plenty of cash, not wanting to embarrass herself wrong?",-1,it is not acceptable,action_question,Is {action} wrong?,moral_stories
295,295,Is Patricia loudly exclaims at her interview that she is the best candidate and should get the position because she's been there the longest wrong?,-1,it is unethical,action_question,Is {action} wrong?,moral_stories
296,296,Is judging someone's opinion based on whether they have kids or not wrong?,-1,it's wrong,action_question,Is {action} wrong?,social_chem
297,297,Is wanting to do things you spent money on wrong?,0,It is understandable,action_question,Is {action} wrong?,social_chem
298,298,Is having a dream wrong?,1,It's good,action_question,Is {action} wrong?,social_chem
299,299,Is having doubts wrong?,0,it's okay,action_question,Is {action} wrong?,social_chem
300,300,Is being with someone who always talks about their ex wrong?,-1,You shouldn't,action_question,Is {action} wrong?,social_chem
301,301,Is Han doesn't go to to work and just lies back down and going back to sleep wrong?,-1,It is bad,action_question,Is {action} wrong?,moral_stories
302,302,Is remaining enrolled in college wrong?,0,It's expected,action_question,Is {action} wrong?,social_chem
303,303,Is deceiving others wrong?,-1,It is wrong,action_question,Is {action} wrong?,social_chem
304,304,Is treating yourself sometimes wrong?,0,It's ok,action_question,Is {action} wrong?,social_chem
305,305,Is not crying about things wrong?,0,It's okay,action_question,Is {action} wrong?,social_chem
306,306,Is feeling guilty about lying to a librarian wrong?,0,It is okay,action_question,Is {action} wrong?,social_chem
307,307,Is procrastinating wrong?,-1,it's bad,action_question,Is {action} wrong?,social_chem
308,308,"Is I thought the other team deserved to win the professional baseball game since they were a little better us usually, so I intentionally hit three strikes so that their team could win wrong?",-1,It's wrong,action_question,Is {action} wrong?,ethics_commonsense_morality
309,309,Is pets being well behaved wrong?,0,It is expected,action_question,Is {action} wrong?,social_chem
310,310,Is being accepting of yourself wrong?,1,It's good,action_question,Is {action} wrong?,social_chem
311,311,Is helping the people you love when you win a lot of money wrong?,1,you should,action_question,Is {action} wrong?,social_chem
312,312,Is having a weird phobia such as avian phobia wrong?,0,It's okay,action_question,Is {action} wrong?,social_chem
313,313,Is couples talking about their sexual needs with each other wrong?,0,it's expected,action_question,Is {action} wrong?,social_chem
314,314,Is trying different things wrong?,0,It's good,action_question,Is {action} wrong?,social_chem
315,315,Is wishing white people would breed with black people just because you hate both races wrong?,-1,It's wrong,action_question,Is {action} wrong?,social_chem
316,316,Is kicking your sibling out of your place wrong?,-1,they might resent you,action_question,Is {action} wrong?,social_chem
317,317,Is attending your graduation ceremony wrong?,0,It's expected,action_question,Is {action} wrong?,social_chem
318,318,Is calling someone's name out if you lose them wrong?,1,It's good,action_question,Is {action} wrong?,social_chem
319,319,Is making sure you're careful when you skateboard wrong?,1,You should,action_question,Is {action} wrong?,social_chem
320,320,Is people being attached to their pets wrong?,0,it's normal,action_question,Is {action} wrong?,social_chem
321,321,Is taking time away from friends wrong?,0,it's okay,action_question,Is {action} wrong?,social_chem
322,322,Is compromising with your significant other when it comes to family obligations wrong?,1,you should,action_question,Is {action} wrong?,social_chem
323,323,Is treating customer service workers with respect wrong?,0,It is expected,action_question,Is {action} wrong?,social_chem
324,324,Is parents teaching their children how to protect themselves wrong?,0,It is expected,action_question,Is {action} wrong?,social_chem
325,325,Is being skeptical of others achievements wrong?,0,It's okay for people,action_question,Is {action} wrong?,social_chem
326,326,Is takeing time to think about what you need to do wrong?,0,It's fine,action_question,Is {action} wrong?,social_chem
327,327,Is striving for authenticity when putting on a play wrong?,0,It's good,action_question,Is {action} wrong?,social_chem
328,328,Is not taking employee input wrong?,-1,It's wrong for a boss,action_question,Is {action} wrong?,social_chem
329,329,Is Joss finishing the cookies and throwing the empty package into a trash can before checking out wrong?,-1,it's unethical,action_question,Is {action} wrong?,moral_stories
330,330,Is wasting or throwing away perfectly good items wrong?,-1,It is bad,action_question,Is {action} wrong?,social_chem
331,331,Is attending your future in-law's bridal shower wrong?,1,It's expected,action_question,Is {action} wrong?,social_chem
332,332,Is staring at someone when talking to them wrong?,-1,it is bad,action_question,Is {action} wrong?,social_chem
333,333,Is Jay pushing Marla who is next to him into Marty which knocks Marty out of the way but Marla is now in the path wrong?,-1,it's not okay,action_question,Is {action} wrong?,moral_stories
334,334,Is leading someone on in a relationship wrong?,-1,it's wrong,action_question,Is {action} wrong?,social_chem
335,335,Is being intentionally harsh to people wrong?,-1,it's rude,action_question,Is {action} wrong?,social_chem
336,336,Is telling other people what to eat wrong?,-1,You shouldn't,action_question,Is {action} wrong?,social_chem
337,337,Is feeling insulted if someone doesn't want to touch you wrong?,-1,it's wrong,action_question,Is {action} wrong?,social_chem
338,338,Is being different wrong?,1,It is good,action_question,Is {action} wrong?,social_chem
339,339,Is friends helping each other wrong?,0,it's expected,action_question,Is {action} wrong?,social_chem
340,340,"Is Selena telling her boyfriend that she appreciates him cooking her dinner, then says it was delicious so as not to hurt his feelings wrong?",-1,It's not okay,action_question,Is {action} wrong?,moral_stories
341,341,Is not getting a pet if not everybody involved is ready for the commitment wrong?,1,it's best,action_question,Is {action} wrong?,social_chem
342,342,Is talking with a therapist if you are feeing depressed wrong?,0,you should,action_question,Is {action} wrong?,social_chem
343,343,Is making people feel inadequate wrong?,-1,it's rude,action_question,Is {action} wrong?,social_chem
344,344,Is Candy calling out to her friend across the library to understand the material wrong?,-1,It is unethical,action_question,Is {action} wrong?,moral_stories
345,345,Is parents teaching their children proper behavior wrong?,0,It is expected,action_question,Is {action} wrong?,social_chem
346,346,Is wanting to hang out with friends after school wrong?,0,it is common,action_question,Is {action} wrong?,social_chem
347,347,Is picking up things you find wrong?,1,You should always,action_question,Is {action} wrong?,social_chem
348,348,Is being careful around expensive things wrong?,1,you should,action_question,Is {action} wrong?,social_chem
349,349,"Is After reading several chapters of his favorite book, Josh cooks supper for himself and jaring wrong?",1,it is ok,action_question,Is {action} wrong?,moral_stories
350,350,Is expecting an ex to contact you on your birthday wrong?,-1,It is wrong,action_question,Is {action} wrong?,social_chem
351,351,Is being nice to people in their birthday wrong?,1,You should,action_question,Is {action} wrong?,social_chem
352,352,Is not being there for your partner wrong?,-1,It is wrong,action_question,Is {action} wrong?,social_chem
353,353,Is giving a birthday card to your kids for their birthday wrong?,1,It's good,action_question,Is {action} wrong?,social_chem
354,354,Is being disrespectful to your partner wrong?,-1,it's not okay,action_question,Is {action} wrong?,social_chem
355,355,Is trying to help your partner thru a difficult time wrong?,1,It's good,action_question,Is {action} wrong?,social_chem
356,356,Is Jared asking his friend's wife if he can be introduced to her sister as someone to possibly date wrong?,1,It is acceptable,action_question,Is {action} wrong?,moral_stories
357,357,Is realizing you made a mistake and admit it wrong?,1,It's good,action_question,Is {action} wrong?,social_chem
358,358,Is talking things out with your partner wrong?,0,It's good,action_question,Is {action} wrong?,social_chem
359,359,Is celebrating your good news wrong?,1,It's good,action_question,Is {action} wrong?,social_chem
360,360,Is taking on a bigger loan than you can afford wrong?,-1,You shouldn't,action_question,Is {action} wrong?,social_chem
361,361,Is breaking an agreement with another person wrong?,-1,It's wrong,action_question,Is {action} wrong?,social_chem
362,362,Is having a friendship that blossoms into romance and it being exciting wrong?,0,It's expected,action_question,Is {action} wrong?,social_chem
363,363,"Is Mike continuing until the funeral line is very close, then slowly pulls to the side of the road wrong?",1,it's moral,action_question,Is {action} wrong?,moral_stories
364,364,Is working on changing your personality for the better.When you aren't as good looking as you were in high school wrong?,0,you should,action_question,Is {action} wrong?,social_chem
365,365,Is some people being afraid of wasps wrong?,0,it is expected,action_question,Is {action} wrong?,social_chem
366,366,Is pet owners taking care of their pets wrong?,0,it's expected,action_question,Is {action} wrong?,social_chem
367,367,Is having a wild imagination wrong?,1,it's good,action_question,Is {action} wrong?,social_chem
368,368,Is listening to everyone's problems wrong?,-1,You shouldn't have to,action_question,Is {action} wrong?,social_chem
369,369,Is ghosting an ex co-worker if you were good friends wrong?,-1,It's rude,action_question,Is {action} wrong?,social_chem
370,370,Is staying with a partner who messes up big time wrong?,0,You shouldn't,action_question,Is {action} wrong?,social_chem
371,371,Is paying your friends back for their services wrong?,0,You should,action_question,Is {action} wrong?,social_chem
372,372,Is celebrating anniversaries wrong?,0,It is expected,action_question,Is {action} wrong?,social_chem
373,373,Is Chris building a fence and doghouse in the backyard for the puppy wrong?,1,it is good,action_question,Is {action} wrong?,moral_stories
374,374,Is Kathryn deciding she can manage skydiving even though it's scary to her wrong?,1,it is fine,action_question,Is {action} wrong?,moral_stories
375,375,Is not being upset if your friendships from high school don't last wrong?,0,it's good,action_question,Is {action} wrong?,social_chem
376,376,Is I bought some firearms at the local Walmart wrong?,1,it is okay,action_question,Is {action} wrong?,ethics_commonsense_morality
377,377,Is Ed spending his days playing computer games and doesn't try to find a job or offer Brian any money for food or rent wrong?,-1,it's unethical,action_question,Is {action} wrong?,moral_stories
378,378,Is ending relationship that isn't working for you wrong?,1,It's ok,action_question,Is {action} wrong?,social_chem
379,379,Is accepting an invitation if you don't want to go wrong?,-1,You shouldn't,action_question,Is {action} wrong?,social_chem
380,380,Is Kirby calmly explains that the toy wore out from being played with so much wrong?,1,It's okay,action_question,Is {action} wrong?,moral_stories
381,381,Is taking your own life wrong?,-1,It's wrong,action_question,Is {action} wrong?,social_chem
382,382,Is not including someone in your group project wrong?,-1,it's wrong,action_question,Is {action} wrong?,social_chem
383,383,Is not negotiating with your spouse on your wedding location and choosing something you both like wrong?,1,it's good,action_question,Is {action} wrong?,social_chem
384,384,Is not dating someone if you don't find them attractive wrong?,0,it's okay,action_question,Is {action} wrong?,social_chem
385,385,Is not giving into every demand made by a friend wrong?,0,It's okay,action_question,Is {action} wrong?,social_chem
386,386,Is reading new things wrong?,0,It's good,action_question,Is {action} wrong?,social_chem
387,387,Is making up a bad birthday to your girlfriend when you did something wrong wrong?,1,it's good,action_question,Is {action} wrong?,social_chem
388,388,"Is Dale taking his roommate's pill, even though he has no idea what it is wrong?",-1,it is wrong,action_question,Is {action} wrong?,moral_stories
389,389,Is I decided to serve my kids worms for dinner wrong?,-1,It is not acceptable,action_question,Is {action} wrong?,ethics_commonsense_morality
390,390,Is Chad making sure to invite all the kids in his class to his house wrong?,1,It's good,action_question,Is {action} wrong?,moral_stories
391,391,Is getting angry because people leave wrong?,0,It is normal,action_question,Is {action} wrong?,social_chem
392,392,Is bringing your children down wrong?,-1,It's wrong,action_question,Is {action} wrong?,social_chem
393,393,Is telling your spouse that they can't go somewhere wrong?,-1,it's wrong,action_question,Is {action} wrong?,social_chem
394,394,Is being attentive to your kids when they're teenagers wrong?,1,It's good,action_question,Is {action} wrong?,social_chem
395,395,Is planting things in the ground wrong?,1,it is good,action_question,Is {action} wrong?,social_chem
396,396,Is staying in touch with family wrong?,0,It's expected,action_question,Is {action} wrong?,social_chem
397,397,Is having consistent moods wrong?,0,it's expected,action_question,Is {action} wrong?,social_chem
398,398,Is choosing a different form of birth control from your friends wrong?,0,It is okay,action_question,Is {action} wrong?,social_chem
399,399,Is children beating up their parents wrong?,-1,they shouldn't,action_question,Is {action} wrong?,social_chem
