,id,context,class_label,text_label,input_type,pattern,source
400,400,Is a spouse getting jealous about a business trip wrong?,0,It is normal,action_question,Is {action} wrong?,social_chem
401,401,Is having laws wrong?,1,It's good,action_question,Is {action} wrong?,social_chem
402,402,Is expecting guys to be proud of their large penis wrong?,0,You should,action_question,Is {action} wrong?,social_chem
403,403,Is not making recipes with foods you hate wrong?,0,it's normal,action_question,Is {action} wrong?,social_chem
404,404,Is doing something that hurts another's feelings wrong?,-1,it's wrong,action_question,Is {action} wrong?,social_chem
405,405,Is Sally going online and ordering herself a new laptop charger that will arrive that afternoon wrong?,1,it's okay,action_question,Is {action} wrong?,moral_stories
406,406,Is reaching out for help wrong?,0,It's good,action_question,Is {action} wrong?,social_chem
407,407,Is feeling preoccupied by your feelings for someone wrong?,0,it's okay,action_question,Is {action} wrong?,social_chem
408,408,Is trying new things wrong?,0,It's good,action_question,Is {action} wrong?,social_chem
409,409,Is not wanting to be friends with everyone wrong?,0,it's understandable,action_question,Is {action} wrong?,social_chem
410,410,Is being slightly gender non-conforming wrong?,0,it's okay,action_question,Is {action} wrong?,social_chem
411,411,Is blaming your actions on another person wrong?,-1,It is irresponsible,action_question,Is {action} wrong?,social_chem
412,412,Is helping out your grandkids and keep their secrets wrong?,1,You should always,action_question,Is {action} wrong?,social_chem
413,413,Is not including others in your personal hobbies wrong?,0,it's okay,action_question,Is {action} wrong?,social_chem
414,414,Is keeping others waiting wrong?,-1,It's rude,action_question,Is {action} wrong?,social_chem
415,415,Is going off on your partner wrong?,-1,You shouldn't,action_question,Is {action} wrong?,social_chem
416,416,Is acquiring special skills wrong?,1,it's good,action_question,Is {action} wrong?,social_chem
417,417,Is calling authorities if a homeless person is on your porch with bad intent or trying to break in wrong?,0,It is good,action_question,Is {action} wrong?,social_chem
418,418,Is mishandling sensitive documents wrong?,-1,It is bad,action_question,Is {action} wrong?,social_chem
419,419,Is making a disaster plan that benefits your neighbor wrong?,1,It's kind,action_question,Is {action} wrong?,social_chem
420,420,Is not attending a party wrong?,-1,It's wrong,action_question,Is {action} wrong?,social_chem
421,421,Is helping out students if it's for a class wrong?,1,it's good,action_question,Is {action} wrong?,social_chem
422,422,Is siblings standing up for each other wrong?,1,It's expected,action_question,Is {action} wrong?,social_chem
423,423,Is dating your teacher wrong?,-1,It's wrong,action_question,Is {action} wrong?,social_chem
424,424,Is replacing items that are broken wrong?,0,it is expected,action_question,Is {action} wrong?,social_chem
425,425,Is being upset with friends when they do something wrong wrong?,0,it's understandable,action_question,Is {action} wrong?,social_chem
426,426,Is always expecting the worst wrong?,-1,It's discouraged,action_question,Is {action} wrong?,social_chem
427,427,Is Violet asking her mother if she can have a cookie after dinner wrong?,1,it's moral,action_question,Is {action} wrong?,moral_stories
428,428,Is parents looking out for their kids wrong?,1,it's expected,action_question,Is {action} wrong?,social_chem
429,429,"Is Kenny knowing he if drives fast he can get to work on time, so he drives over the speed limit the whole way wrong?",-1,It is not okay,action_question,Is {action} wrong?,moral_stories
430,430,Is revisiting things that remind you of a missing loved one wrong?,0,it is acceptable,action_question,Is {action} wrong?,social_chem
431,431,"Is Mike trying to tell his parents how they are annoying him, but he ends up screaming in their faces wrong?",-1,It's not ok,action_question,Is {action} wrong?,moral_stories
432,432,Is Matt going into work for his shift wrong?,-1,It is not good,action_question,Is {action} wrong?,moral_stories
433,433,Is giving people space when they are upset with you wrong?,0,It's important,action_question,Is {action} wrong?,social_chem
434,434,Is not having more children than you can afford wrong?,0,It's wise,action_question,Is {action} wrong?,social_chem
435,435,Is James yelping in pain then goes on muttering about how stupid he is and how he always does this wrong?,-1,it is not okay,action_question,Is {action} wrong?,moral_stories
436,436,Is Ann asking her husband to pick up her son wrong?,1,It's good,action_question,Is {action} wrong?,moral_stories
437,437,Is encouraging people to read more wrong?,1,it's good,action_question,Is {action} wrong?,social_chem
438,438,Is practicing your skills wrong?,1,it's good,action_question,Is {action} wrong?,social_chem
439,439,Is prioritizing people over possessions wrong?,1,It's important,action_question,Is {action} wrong?,social_chem
440,440,Is asking someone to pay for something they didn't want wrong?,-1,it's wrong,action_question,Is {action} wrong?,social_chem
441,441,Is holding alcoholics who relapse accountable for their own recovery wrong?,0,It's important,action_question,Is {action} wrong?,social_chem
442,442,"Is While I was on my way home driving on the road, I purposely hit a deer wrong?",-1,it is not okay,action_question,Is {action} wrong?,ethics_commonsense_morality
443,443,Is being a procrastinator wrong?,-1,It's bad,action_question,Is {action} wrong?,social_chem
444,444,Is coming back to your hometown to visit a man but not to see your family wrong?,-1,is rude,action_question,Is {action} wrong?,social_chem
445,445,Is harming yourself wrong?,-1,It's bad,action_question,Is {action} wrong?,social_chem
446,446,Is Jerry noticing a coworkers lunch and eating it without asking wrong?,-1,it's unethical,action_question,Is {action} wrong?,moral_stories
447,447,Is refusing a relationship with someone who has wronged you wrong?,0,It's OK,action_question,Is {action} wrong?,social_chem
448,448,Is not keeping up with the times wrong?,-1,It's not okay,action_question,Is {action} wrong?,social_chem
449,449,Is abandoning your family wrong?,-1,It is wrong,action_question,Is {action} wrong?,social_chem
450,450,Is keeping the house messy wrong?,-1,is inconsiderate,action_question,Is {action} wrong?,social_chem
451,451,Is asking your parent to have more patients with you wrong?,0,it's reasonable,action_question,Is {action} wrong?,social_chem
452,452,Is teaching their children how to properly treat other children wrong?,0,You should,action_question,Is {action} wrong?,social_chem
453,453,Is not wanting your parents to know everything about you or your life wrong?,0,It's understandable,action_question,Is {action} wrong?,social_chem
454,454,Is not always getting along with your coworkers wrong?,0,It's normal,action_question,Is {action} wrong?,social_chem
455,455,Is expecting someone to clean up a mess they didn't make wrong?,-1,It is wrong,action_question,Is {action} wrong?,social_chem
456,456,Is Ryan asking about what movies she likes and expressing a genuine interest in seeing them sometime wrong?,1,It is good,action_question,Is {action} wrong?,moral_stories
457,457,Is Kelly declaring her religion the national religion that all citizens must adhere to because she thinks it is the morally right thing to do wrong?,-1,It is wrong,action_question,Is {action} wrong?,moral_stories
458,458,Is gaining some allies wrong?,0,It's good,action_question,Is {action} wrong?,social_chem
459,459,Is not liking something wrong?,-1,it's okay,action_question,Is {action} wrong?,social_chem
460,460,Is not liking all of your significant other's hobbies wrong?,0,It’s understandable,action_question,Is {action} wrong?,social_chem
461,461,Is being concerned about your child cohabiting wrong?,0,It's understandable,action_question,Is {action} wrong?,social_chem
462,462,Is wanting space from your friends wrong?,0,It's okay,action_question,Is {action} wrong?,social_chem
463,463,Is cutting liars out of your life wrong?,1,It's good,action_question,Is {action} wrong?,social_chem
464,464,Is people and circumstances changing a lot over time wrong?,0,it's expected,action_question,Is {action} wrong?,social_chem
465,465,Is supporting your family wrong?,0,you should,action_question,Is {action} wrong?,social_chem
466,466,Is buying a new instrument so you can learn it wrong?,0,it's good,action_question,Is {action} wrong?,social_chem
467,467,Is being mediocre wrong?,-1,It's wrong,action_question,Is {action} wrong?,social_chem
468,468,Is giving someone advice wrong?,1,it's good,action_question,Is {action} wrong?,social_chem
469,469,Is helping family members wrong?,1,It is good,action_question,Is {action} wrong?,social_chem
470,470,Is taking what you paid for wrong?,0,It's good,action_question,Is {action} wrong?,social_chem
471,471,Is calling the police on your neighbor's party wrong?,-1,It's rude,action_question,Is {action} wrong?,social_chem
472,472,Is Jones bringing a few of his friends alone with him to the park wrong?,1,it's moral,action_question,Is {action} wrong?,moral_stories
473,473,Is Mike asking his teacher if he can work in the computer lab during lunch wrong?,1,it's good,action_question,Is {action} wrong?,moral_stories
474,474,Is I washed my younger sister's hands with soap wrong?,1,It is good,action_question,Is {action} wrong?,ethics_commonsense_morality
475,475,Is worrying as a mother about how your child spends their time wrong?,0,It's normal,action_question,Is {action} wrong?,social_chem
476,476,"Is At the winery, I washed my feet before crushing grapes with them wrong?",1,it's ethical,action_question,Is {action} wrong?,ethics_commonsense_morality
477,477,Is learning a musical instrument wrong?,0,It's good,action_question,Is {action} wrong?,social_chem
478,478,Is coercing others into doing things wrong?,-1,It's wrong,action_question,Is {action} wrong?,social_chem
479,479,Is being rude to your elders wrong?,-1,It is not okay,action_question,Is {action} wrong?,social_chem
480,480,Is I sell toys containing lead paint wrong?,-1,It's wrong,action_question,Is {action} wrong?,ethics_commonsense_morality
481,481,Is not trying and changing it when you know that you are not living right wrong?,-1,it's wrong,action_question,Is {action} wrong?,social_chem
482,482,Is leaving people you care or care about you with out giving them a reason wrong?,-1,It's not okay,action_question,Is {action} wrong?,social_chem
483,483,Is expecting someone to broadcast their personal life wrong?,-1,It is wrong,action_question,Is {action} wrong?,social_chem
484,484,Is wishing harm on another person wrong?,-1,It's wrong,action_question,Is {action} wrong?,social_chem
485,485,Is letting your friends or roommates cause problems with you and your significant other wrong?,-1,you shouldn't,action_question,Is {action} wrong?,social_chem
486,486,Is being silly about things sometimes wrong?,0,It's good to,action_question,Is {action} wrong?,social_chem
487,487,Is telling someone that their significant other is cheating on them wrong?,0,It's fine,action_question,Is {action} wrong?,social_chem
488,488,Is doing things you would consider the worst wrong?,-1,It’s bad,action_question,Is {action} wrong?,social_chem
489,489,Is removing someone's only means of communicating wrong?,-1,It's rude,action_question,Is {action} wrong?,social_chem
490,490,Is waiting to announce your pregnancy wrong?,0,it's good,action_question,Is {action} wrong?,social_chem
491,491,Is not talking to a relative if you have never met them wrong?,0,it's ok,action_question,Is {action} wrong?,social_chem
492,492,Is feeling proud of your partner's good deeds wrong?,0,you should,action_question,Is {action} wrong?,social_chem
493,493,Is families supporting one another wrong?,0,It's expected,action_question,Is {action} wrong?,social_chem
494,494,Is keeping parts of your life private wrong?,0,It is okay,action_question,Is {action} wrong?,social_chem
495,495,Is not inviting tons of people at once to your house wrong?,0,it's ok,action_question,Is {action} wrong?,social_chem
496,496,Is Frank explaining that his son has to do chores to replace the lamp wrong?,1,it is acceptable,action_question,Is {action} wrong?,moral_stories
497,497,Is people trying to be good people wrong?,1,it's expected,action_question,Is {action} wrong?,social_chem
498,498,Is I gave the woman a ride who was walking in the rain wrong?,1,It is okay,action_question,Is {action} wrong?,ethics_commonsense_morality
499,499,Is being a good Samaritan and help others wrong?,1,it's good,action_question,Is {action} wrong?,social_chem
